Codec: Conexant CX20632
Address: 0
AFG Function Id: 0x1 (unsol 1)
Vendor Id: 0x14f15098
Subsystem Id: 0x14f1037f
Revision Id: 0x100100
No Modem Function Group found
Default PCM:
    rates [0x160]: 44100 48000 96000
    bits [0xe]: 16 20 24
    formats [0x1]: PCM
Default Amp-In caps: N/A
Default Amp-Out caps: N/A
State of AFG node 0x01:
  Power states:  D0 D1 D2 D3 D3cold S3D3cold CLKSTOP EPSS
  Power: setting=D0, actual=D0
GPIO: io=5, o=0, i=0, unsolicited=1, wake=1
  IO[0]: enable=0, dir=0, wake=0, sticky=0, data=0, unsol=0
  IO[1]: enable=0, dir=0, wake=0, sticky=0, data=0, unsol=0
  IO[2]: enable=0, dir=0, wake=0, sticky=0, data=0, unsol=0
  IO[3]: enable=0, dir=0, wake=0, sticky=0, data=0, unsol=0
  IO[4]: enable=0, dir=0, wake=0, sticky=0, data=0, unsol=0
Node 0x27 [Vendor Defined Widget]:
  PC beep: independent mode(default)
  Class D: stereo mode(default)
  Speaker power: ???
  GS Mark: Disabled
  High pass filter: 120Hz(default)
  Low pass filter: Disabled
  Adjust 3.3V LDO voltage: 0x0
Node 0x10 [Audio Output] wcaps 0xc1d: Stereo Amp-Out R/L
  Control: name="Headphone Playback Volume", index=0, device=0
    ControlAmp: chs=3, dir=Out, idx=0, ofs=0
  Control: name="Headphone Playback Switch", index=0, device=0
    ControlAmp: chs=3, dir=Out, idx=0, ofs=0
  Device: name="CX20632 Analog", type="Audio", device=0
  Amp-Out caps: ofs=0x4a, nsteps=0x4a, stepsize=0x03, mute=1
  Amp-Out vals:  [0x80 0x80]
  Converter: stream=5, channel=0
  PCM:
    rates [0x560]: 44100 48000 96000 192000
    bits [0xe]: 16 20 24
    formats [0x1]: PCM
  Power states:  D0 D1 D2 D3 EPSS
  Power: setting=D0, actual=D0
Node 0x11 [Audio Output] wcaps 0xc1d: Stereo Amp-Out R/L
  Control: name="Headphone Playback Volume", index=1, device=0
    ControlAmp: chs=3, dir=Out, idx=0, ofs=0
  Control: name="Headphone Playback Switch", index=1, device=0
    ControlAmp: chs=3, dir=Out, idx=0, ofs=0
  Amp-Out caps: ofs=0x4a, nsteps=0x4a, stepsize=0x03, mute=1
  Amp-Out vals:  [0x40 0x40]
  Converter: stream=5, channel=0
  PCM:
    rates [0x560]: 44100 48000 96000 192000
    bits [0xe]: 16 20 24
    formats [0x1]: PCM
  Power states:  D0 D1 D2 D3 EPSS
  Power: setting=D0, actual=D0
Node 0x12 [Audio Output] wcaps 0x611: Stereo Digital
  Converter: stream=0, channel=0
  Digital:
  Digital category: 0x0
  IEC Coding Type: 0x0
  PCM:
    rates [0x5e0]: 44100 48000 88200 96000 192000
    bits [0xe]: 16 20 24
    formats [0x5]: PCM AC3
  Power states:  D0 D1 D2 D3 EPSS
  Power: setting=D0, actual=D0
Node 0x13 [Beep Generator Widget] wcaps 0x70000c: Mono Amp-Out
  Control: name="Beep Playback Volume", index=0, device=0
    ControlAmp: chs=1, dir=Out, idx=0, ofs=0
  Control: name="Beep Playback Switch", index=0, device=0
    ControlAmp: chs=1, dir=Out, idx=0, ofs=0
  Amp-Out caps: ofs=0x07, nsteps=0x07, stepsize=0x0f, mute=0
  Amp-Out vals:  [0x00]
Node 0x14 [Audio Input] wcaps 0x100d1b: Stereo Amp-In R/L
  Control: name="Capture Volume", index=0, device=0
    ControlAmp: chs=3, dir=In, idx=2, ofs=0
  Control: name="Capture Switch", index=0, device=0
    ControlAmp: chs=3, dir=In, idx=2, ofs=0
  Device: name="CX20632 Analog", type="Audio", device=0
  Amp-In caps: ofs=0x4a, nsteps=0x50, stepsize=0x03, mute=1
  Amp-In vals:  [0x50 0x50] [0x50 0x50] [0x50 0x50] [0x80 0x80]
  Converter: stream=1, channel=0
  SDI-Select: 0
  PCM:
    rates [0x160]: 44100 48000 96000
    bits [0xe]: 16 20 24
    formats [0x1]: PCM
  Power states:  D0 D1 D2 D3 EPSS
  Power: setting=D0, actual=D0
  Connection: 4
     0x1a 0x1b* 0x1d 0x1e
Node 0x15 [Audio Input] wcaps 0x100d1b: Stereo Amp-In R/L
  Control: name="Capture Volume", index=1, device=0
    ControlAmp: chs=3, dir=In, idx=1, ofs=0
  Control: name="Capture Switch", index=1, device=0
    ControlAmp: chs=3, dir=In, idx=1, ofs=0
  Device: name="CX20632 Alt Analog", type="Audio", device=2
  Amp-In caps: ofs=0x4a, nsteps=0x50, stepsize=0x03, mute=1
  Amp-In vals:  [0x80 0x80] [0x80 0x80] [0x80 0x80] [0x80 0x80]
  Converter: stream=0, channel=0
  SDI-Select: 0
  PCM:
    rates [0x160]: 44100 48000 96000
    bits [0xe]: 16 20 24
    formats [0x1]: PCM
  Power states:  D0 D1 D2 D3 EPSS
  Power: setting=D0, actual=D0
  Connection: 4
     0x1a 0x1b* 0x1d 0x1e
Node 0x16 [Audio Input] wcaps 0x100d1b: Stereo Amp-In R/L
  Amp-In caps: ofs=0x4a, nsteps=0x50, stepsize=0x03, mute=1
  Amp-In vals:  [0x4a 0x4a]
  Converter: stream=0, channel=0
  SDI-Select: 0
  PCM:
    rates [0x160]: 44100 48000 96000
    bits [0xe]: 16 20 24
    formats [0x1]: PCM
  Power states:  D0 D1 D2 D3 EPSS
  Power: setting=D0, actual=D0
  Connection: 1
     0x22
Node 0x17 [Audio Output] wcaps 0xc1d: Stereo Amp-Out R/L
  Control: name="Speaker Playback Volume", index=0, device=0
    ControlAmp: chs=3, dir=Out, idx=0, ofs=0
  Control: name="Speaker Playback Switch", index=0, device=0
    ControlAmp: chs=3, dir=Out, idx=0, ofs=0
  Amp-Out caps: ofs=0x4a, nsteps=0x4a, stepsize=0x03, mute=1
  Amp-Out vals:  [0x40 0x40]
  Converter: stream=5, channel=0
  PCM:
    rates [0x560]: 44100 48000 96000 192000
    bits [0xe]: 16 20 24
    formats [0x1]: PCM
  Power states:  D0 D1 D2 D3 EPSS
  Power: setting=D0, actual=D0
Node 0x18 [Pin Complex] wcaps 0x400581: Stereo
  Pincap 0x00010014: OUT EAPD Detect
  EAPD 0x2: EAPD
  Pin Default 0x40f001f0: [N/A] Other at Ext N/A
    Conn = Unknown, Color = Unknown
    DefAssociation = 0xf, Sequence = 0x0
    Misc = NO_PRESENCE
  Pin-ctls: 0x40: OUT
  Unsolicited: tag=00, enabled=0
  Power states:  D0 D1 D2 D3 EPSS
  Power: setting=D0, actual=D0
  Connection: 3
     0x10* 0x11 0x17
Node 0x19 [Pin Complex] wcaps 0x400581: Stereo
  Pincap 0x0000001c: OUT HP Detect
  Pin Default 0x02211040: [Jack] HP Out at Ext Front
    Conn = 1/8, Color = Black
    DefAssociation = 0x4, Sequence = 0x0
  Pin-ctls: 0xc0: OUT HP
  Unsolicited: tag=01, enabled=1
  Power states:  D0 D1 D2 D3 EPSS
  Power: setting=D0, actual=D0
  Connection: 3
     0x10* 0x11 0x17
Node 0x1a [Pin Complex] wcaps 0x40048b: Stereo Amp-In
  Control: name="Front Mic Boost Volume", index=0, device=0
    ControlAmp: chs=3, dir=In, idx=0, ofs=0
  Amp-In caps: ofs=0x00, nsteps=0x04, stepsize=0x27, mute=0
  Amp-In vals:  [0x00 0x00]
  Pincap 0x00001324: IN Detect
    Vref caps: HIZ 50 80
  Pin Default 0x02a11030: [Jack] Mic at Ext Front
    Conn = 1/8, Color = Black
    DefAssociation = 0x3, Sequence = 0x0
  Pin-ctls: 0x24: IN VREF_80
  Unsolicited: tag=04, enabled=1
  Power states:  D0 D1 D2 D3 EPSS
  Power: setting=D0, actual=D0
Node 0x1b [Pin Complex] wcaps 0x40058b: Stereo Amp-In
  Control: name="Rear Mic Boost Volume", index=0, device=0
    ControlAmp: chs=3, dir=In, idx=0, ofs=0
  Amp-In caps: ofs=0x00, nsteps=0x04, stepsize=0x27, mute=0
  Amp-In vals:  [0x00 0x00]
  Pincap 0x00011334: IN OUT EAPD Detect
    Vref caps: HIZ 50 80
  EAPD 0x2: EAPD
  Pin Default 0x01a13020: [Jack] Mic at Ext Rear
    Conn = 1/8, Color = Blue
    DefAssociation = 0x2, Sequence = 0x0
  Pin-ctls: 0x24: IN VREF_80
  Unsolicited: tag=03, enabled=1
  Power states:  D0 D1 D2 D3 EPSS
  Power: setting=D0, actual=D0
  Connection: 3
     0x10* 0x11 0x17
Node 0x1c [Pin Complex] wcaps 0x400581: Stereo
  Pincap 0x0000001c: OUT HP Detect
  Pin Default 0x01214050: [Jack] HP Out at Ext Rear
    Conn = 1/8, Color = Green
    DefAssociation = 0x5, Sequence = 0x0
  Pin-ctls: 0xc0: OUT HP
  Unsolicited: tag=02, enabled=1
  Power states:  D0 D1 D2 D3 EPSS
  Power: setting=D0, actual=D0
  Connection: 3
     0x10 0x11* 0x17
Node 0x1d [Pin Complex] wcaps 0x40058b: Stereo Amp-In
  Control: name="Line Boost Volume", index=0, device=0
    ControlAmp: chs=3, dir=In, idx=0, ofs=0
  Amp-In caps: ofs=0x00, nsteps=0x04, stepsize=0x27, mute=0
  Amp-In vals:  [0x00 0x00]
  Pincap 0x00010034: IN OUT EAPD Detect
  EAPD 0x2: EAPD
  Pin Default 0x0181102e: [Jack] Line In at Ext Rear
    Conn = 1/8, Color = Black
    DefAssociation = 0x2, Sequence = 0xe
  Pin-ctls: 0x20: IN
  Unsolicited: tag=05, enabled=1
  Power states:  D0 D1 D2 D3 EPSS
  Power: setting=D0, actual=D0
  Connection: 3
     0x10* 0x11 0x17
Node 0x1e [Pin Complex] wcaps 0x40040b: Stereo Amp-In
  Amp-In caps: ofs=0x00, nsteps=0x04, stepsize=0x2f, mute=0
  Amp-In vals:  [0x00 0x00]
  Pincap 0x00000020: IN
  Pin Default 0x40f001f0: [N/A] Other at Ext N/A
    Conn = Unknown, Color = Unknown
    DefAssociation = 0xf, Sequence = 0x0
    Misc = NO_PRESENCE
  Pin-ctls: 0x00:
  Power states:  D0 D1 D2 D3 EPSS
  Power: setting=D0, actual=D0
Node 0x1f [Pin Complex] wcaps 0x400501: Stereo
  Pincap 0x00000010: OUT
  Pin Default 0x90170160: [Fixed] Speaker at Int N/A
    Conn = Analog, Color = Unknown
    DefAssociation = 0x6, Sequence = 0x0
    Misc = NO_PRESENCE
  Pin-ctls: 0x40: OUT
  Power states:  D0 D1 D2 D3 EPSS
  Power: setting=D0, actual=D0
  Connection: 3
     0x10 0x11 0x17*
Node 0x20 [Pin Complex] wcaps 0x400781: Stereo Digital
  Pincap 0x00000014: OUT Detect
  Pin Default 0x40f001f0: [N/A] Other at Ext N/A
    Conn = Unknown, Color = Unknown
    DefAssociation = 0xf, Sequence = 0x0
    Misc = NO_PRESENCE
  Pin-ctls: 0x00:
  Unsolicited: tag=00, enabled=0
  Power states:  D0 D1 D2 D3 EPSS
  Power: setting=D0, actual=D0
  Connection: 1
     0x12
Node 0x21 [Pin Complex] wcaps 0x400501: Stereo
  Pincap 0x00010010: OUT EAPD
  EAPD 0x2: EAPD
  Pin Default 0x40f001f0: [N/A] Other at Ext N/A
    Conn = Unknown, Color = Unknown
    DefAssociation = 0xf, Sequence = 0x0
    Misc = NO_PRESENCE
  Pin-ctls: 0x40: OUT
  Power states:  D0 D1 D2 D3 EPSS
  Power: setting=D0, actual=D0
  Connection: 3
     0x10* 0x11 0x17
Node 0x22 [Audio Mixer] wcaps 0x20050b: Stereo Amp-In
  Amp-In caps: ofs=0x4a, nsteps=0x4a, stepsize=0x03, mute=1
  Amp-In vals:  [0x00 0x00] [0x00 0x00] [0x00 0x00]
  Power states:  D0 D1 D2 D3 EPSS
  Power: setting=D0, actual=D0
  Connection: 3
     0x10 0x11 0x17
Node 0x23 [Vendor Defined Widget] wcaps 0xf00000: Mono
Node 0x24 [Volume Knob Widget] wcaps 0x600080: Mono
  Volume-Knob: delta=1, steps=74, direct=0, val=60
  Unsolicited: tag=00, enabled=0
  Connection: 3
     0x10 0x11 0x17
Node 0x25 [Audio Input] wcaps 0x100711: Stereo Digital
  Converter: stream=0, channel=0
  SDI-Select: 0
  Digital:
  Digital category: 0x0
  IEC Coding Type: 0x0
  PCM:
    rates [0x560]: 44100 48000 96000 192000
    bits [0xe]: 16 20 24
    formats [0x5]: PCM AC3
  Power states:  D0 D1 D2 D3 EPSS
  Power: setting=D0, actual=D0
  Connection: 1
     0x26
Node 0x26 [Pin Complex] wcaps 0x400681: Stereo Digital
  Pincap 0x00000024: IN Detect
  Pin Default 0x40f001f0: [N/A] Other at Ext N/A
    Conn = Unknown, Color = Unknown
    DefAssociation = 0xf, Sequence = 0x0
    Misc = NO_PRESENCE
  Pin-ctls: 0x00:
  Unsolicited: tag=00, enabled=0
  Power states:  D0 D1 D2 D3 EPSS
  Power: setting=D0, actual=D0
